{
  "$schema": "./schema.json",
  "meta": {
    "id": "TR-2026-01-11-001",
    "type": "manual",
    "tester": {
      "id": "HAIKU-001",
      "name": "Claude Haiku 4.5",
      "model": "claude-3-haiku"
    },
    "startTime": "2026-01-11T16:35:00Z",
    "endTime": "2026-01-11T17:00:00Z",
    "duration": 1500,
    "version": "2.14.3",
    "environment": {
      "os": "Windows 11",
      "nodeVersion": "v22.17.1",
      "npmVersion": "10.x"
    }
  },
  "summary": {
    "total": 130,
    "passed": 3,
    "failed": 1,
    "skipped": 0,
    "blocked": 125,
    "passRate": 60,
    "productionReady": false,
    "recommendation": "fix-critical"
  },
  "phases": [
    {
      "id": "phase-1",
      "name": "Environment Setup",
      "status": "partial",
      "tests": [
        {
          "id": "1.1",
          "name": "Project Directory",
          "description": "Verify project is in correct location",
          "status": "pass",
          "command": "Get-Location",
          "expected": "D:\\Github\\Telegram-MCP",
          "actual": "D:\\Github\\Telegram-MCP",
          "duration": 100
        },
        {
          "id": "1.2",
          "name": "Node Version",
          "description": "Verify Node.js version meets requirements",
          "status": "pass",
          "command": "node --version",
          "expected": "v18+ or v22+",
          "actual": "v22.17.1",
          "duration": 150
        },
        {
          "id": "1.3",
          "name": "Dependencies Installed",
          "description": "Verify all npm dependencies are installed",
          "status": "partial",
          "command": "npm list --depth=0",
          "expected": "All packages installed",
          "actual": "20+ packages installed, 2 optional missing (better-sqlite3, canvas)",
          "duration": 2000,
          "issueRef": "BUG-003"
        },
        {
          "id": "1.4",
          "name": "Unit Tests Pass",
          "description": "Verify all unit tests pass",
          "status": "pass",
          "command": "npm test",
          "expected": "338 tests passed",
          "actual": "338 tests passed in 6.74s",
          "duration": 6740
        },
        {
          "id": "1.5",
          "name": "Environment Variables",
          "description": "Verify required env vars are set",
          "status": "fail",
          "command": "Check BOT_TOKEN and SUPABASE_URL",
          "expected": "Both variables set",
          "actual": "BOT_TOKEN: Missing, SUPABASE_URL: Missing",
          "duration": 100,
          "error": "Critical environment variables not configured",
          "issueRef": "BUG-002"
        }
      ]
    },
    {
      "id": "phase-2",
      "name": "WebApp & API",
      "status": "blocked",
      "tests": [
        {
          "id": "2.1",
          "name": "Health Endpoint",
          "status": "blocked",
          "issueRef": "BUG-001"
        },
        {
          "id": "2.2",
          "name": "Status Endpoint",
          "status": "blocked",
          "issueRef": "BUG-001"
        }
      ]
    },
    {
      "id": "phase-3",
      "name": "Database",
      "status": "blocked",
      "tests": []
    },
    {
      "id": "phase-4",
      "name": "RSS System",
      "status": "blocked",
      "tests": []
    },
    {
      "id": "phase-5",
      "name": "Channels",
      "status": "blocked",
      "tests": []
    },
    {
      "id": "phase-6",
      "name": "Groups",
      "status": "blocked",
      "tests": []
    },
    {
      "id": "phase-7",
      "name": "Scheduling",
      "status": "blocked",
      "tests": []
    },
    {
      "id": "phase-8",
      "name": "Automation",
      "status": "blocked",
      "tests": []
    },
    {
      "id": "phase-9",
      "name": "Analytics",
      "status": "blocked",
      "tests": []
    },
    {
      "id": "phase-10",
      "name": "Settings",
      "status": "blocked",
      "tests": []
    },
    {
      "id": "phase-11",
      "name": "Error Handling",
      "status": "blocked",
      "tests": []
    }
  ],
  "issues": [
    {
      "id": "BUG-001",
      "severity": "critical",
      "title": "WebApp Server Connection Failure",
      "description": "Test server starts but HTTP clients cannot connect. Connections rejected with ECONNREFUSED.",
      "status": "open",
      "stepsToReproduce": [
        "Run: node test-webapp-server.js",
        "Wait for startup messages",
        "Try: curl http://localhost:3001/health",
        "Connection fails immediately"
      ],
      "expected": "Server accepts connections on http://localhost:3001",
      "actual": "Error: connect ECONNREFUSED 127.0.0.1:3001",
      "affectedTests": ["2.1", "2.2", "2.3", "2.4", "2.5", "2.6", "2.7", "2.8", "2.9", "2.10", "2.11", "2.12", "2.13", "2.14", "2.15"],
      "suggestedFix": "Add explicit IP binding: app.listen(PORT, '127.0.0.1', ...)",
      "createdAt": "2026-01-11T16:50:00Z"
    },
    {
      "id": "BUG-002",
      "severity": "high",
      "title": "Missing Environment Variables",
      "description": "BOT_TOKEN and SUPABASE_URL not set in development environment",
      "status": "open",
      "stepsToReproduce": [
        "Check $env:BOT_TOKEN",
        "Check $env:SUPABASE_URL"
      ],
      "expected": "Both variables configured",
      "actual": "Both variables missing",
      "affectedTests": ["1.5"],
      "suggestedFix": "Create .env file with required credentials",
      "createdAt": "2026-01-11T16:42:00Z"
    },
    {
      "id": "BUG-003",
      "severity": "medium",
      "title": "Unmet Optional Dependencies",
      "description": "better-sqlite3 and canvas packages not installed",
      "status": "open",
      "stepsToReproduce": [
        "Run: npm list --depth=0"
      ],
      "expected": "All packages installed",
      "actual": "UNMET OPTIONAL DEPENDENCY better-sqlite3@^9.6.0, canvas@^2.11.2",
      "affectedTests": ["1.3"],
      "suggestedFix": "npm install --save-optional better-sqlite3 canvas",
      "createdAt": "2026-01-11T16:42:00Z"
    }
  ],
  "metrics": {
    "coverage": 3.8,
    "reliability": 60
  }
}
